{
  "schema_version": "ethguard.live-report/v1",
  "run_id": "01JAZ3K4M5N6P7Q8R9S0T1V2WX",
  "manifest_sha256": "f29ba46d114ed92a2166a7972618ad69e67d50a29e302290aa4ef737ca3270d3",
  "plan_sha256": "d99a78e6a56ffe34ee5351fbd74b14951afb5fef31023280d9d9412b3b2124d8",
  "started_at": "2026-10-23T12:00:00Z",
  "finished_at": "2026-10-23T12:00:41.876Z",
  "duration_ms": 41876,
  "state": "passed",
  "state_reasons": [],
  "reference_step_id": "reference.finalized-balance",
  "steps": [
    {
      "id": "identity.chain-id",
      "phase": "identity",
      "path": "client_call",
      "method": "eth_chainId",
      "logical_request": {
        "method": "eth_chainId",
        "params": []
      },
      "prepared_request": {
        "method": "eth_chainId",
        "params": []
      },
      "reference": null,
      "decision": {
        "status": "corroborated",
        "error_class": "",
        "error_detail": "",
        "n": 3,
        "participants": [
          "node-01",
          "node-02",
          "node-03"
        ],
        "support": [
          "node-01",
          "node-02",
          "node-03"
        ],
        "reject": [],
        "faults": [],
        "collection_faults": [],
        "representative": "node-01",
        "value_sha256": "a03279d346f550999209e77159c3bc678a1e3c9455e2815280078b65d671dfe3",
        "value_kind": "quantity"
      },
      "typed": null,
      "invariants": {
        "request_binding": true,
        "status_allowed": true,
        "evidence_conservation": true,
        "representative_in_support": true,
        "reference_status": null,
        "error_status_exclusive": true,
        "basis_unchanged": true,
        "typed_decode": null,
        "shape_matches_plan": true
      },
      "outcome": "ok"
    },
    {
      "id": "reference.finalized-balance",
      "phase": "reference",
      "path": "client_call",
      "method": "eth_getBalance",
      "logical_request": {
        "method": "eth_getBalance",
        "params": [
          "0xd8dA6BF26964aF9D7eEd9e03E53415D37aA96045",
          "finalized"
        ]
      },
      "prepared_request": {
        "method": "eth_getBalance",
        "params": [
          "0xd8dA6BF26964aF9D7eEd9e03E53415D37aA96045",
          "0x8f3a1c2d4e5f60718293a4b5c6d7e8f90123456789abcdef0123456789abcdef"
        ]
      },
      "reference": {
        "status": "corroborated",
        "tag": "finalized",
        "height": 23500000,
        "hash": "0x8f3a1c2d4e5f60718293a4b5c6d7e8f90123456789abcdef0123456789abcdef",
        "origin": "reported-finalized",
        "observed_at": "2026-10-23T12:00:04Z",
        "n": 3,
        "participants": [
          "node-01",
          "node-02",
          "node-03"
        ],
        "support": [
          "node-01",
          "node-02",
          "node-03"
        ],
        "reject": [],
        "faults": [],
        "collection_faults": []
      },
      "decision": {
        "status": "corroborated",
        "error_class": "",
        "error_detail": "",
        "n": 3,
        "participants": [
          "node-01",
          "node-02",
          "node-03"
        ],
        "support": [
          "node-01",
          "node-02",
          "node-03"
        ],
        "reject": [],
        "faults": [],
        "collection_faults": [],
        "representative": "node-01",
        "value_sha256": "598b318ce1527ab2ebea4f6cb23d29dc8ca73cd5d2918b0e04d465b55c32b75d",
        "value_kind": "quantity"
      },
      "typed": null,
      "invariants": {
        "request_binding": true,
        "status_allowed": true,
        "evidence_conservation": true,
        "representative_in_support": true,
        "reference_status": true,
        "error_status_exclusive": true,
        "basis_unchanged": true,
        "typed_decode": null,
        "shape_matches_plan": true
      },
      "outcome": "ok"
    },
    {
      "id": "pinned.block",
      "phase": "business",
      "path": "client_call",
      "method": "eth_getBlockByHash",
      "logical_request": {
        "method": "eth_getBlockByHash",
        "params": [
          "0x8f3a1c2d4e5f60718293a4b5c6d7e8f90123456789abcdef0123456789abcdef",
          false
        ]
      },
      "prepared_request": {
        "method": "eth_getBlockByHash",
        "params": [
          "0x8f3a1c2d4e5f60718293a4b5c6d7e8f90123456789abcdef0123456789abcdef",
          false
        ]
      },
      "reference": null,
      "decision": {
        "status": "corroborated",
        "error_class": "",
        "error_detail": "",
        "n": 3,
        "participants": [
          "node-01",
          "node-02",
          "node-03"
        ],
        "support": [
          "node-01",
          "node-02",
          "node-03"
        ],
        "reject": [],
        "faults": [],
        "collection_faults": [],
        "representative": "node-01",
        "value_sha256": "b2b2b2b2b2b2b2b2b2b2b2b2b2b2b2b2b2b2b2b2b2b2b2b2b2b2b2b2b2b2b2b2",
        "value_kind": "object"
      },
      "typed": null,
      "invariants": {
        "request_binding": true,
        "status_allowed": true,
        "evidence_conservation": true,
        "representative_in_support": true,
        "reference_status": null,
        "error_status_exclusive": true,
        "basis_unchanged": true,
        "typed_decode": null,
        "shape_matches_plan": true
      },
      "outcome": "ok"
    },
    {
      "id": "business.fee-history.finalized",
      "phase": "business",
      "path": "client_call",
      "method": "eth_feeHistory",
      "logical_request": {
        "method": "eth_feeHistory",
        "params": [
          2,
          "finalized",
          [
            25,
            50,
            75
          ]
        ]
      },
      "prepared_request": {
        "method": "eth_feeHistory",
        "params": [
          2,
          "0x16694e0",
          [
            25,
            50,
            75
          ]
        ]
      },
      "reference": {
        "status": "corroborated",
        "tag": "finalized",
        "height": 23500000,
        "hash": "0x8f3a1c2d4e5f60718293a4b5c6d7e8f90123456789abcdef0123456789abcdef",
        "origin": "reported-finalized",
        "observed_at": "2026-10-23T12:00:21Z",
        "n": 3,
        "participants": [
          "node-01",
          "node-02",
          "node-03"
        ],
        "support": [
          "node-01",
          "node-02",
          "node-03"
        ],
        "reject": [],
        "faults": [],
        "collection_faults": []
      },
      "decision": {
        "status": "corroborated",
        "error_class": "",
        "error_detail": "",
        "n": 3,
        "participants": [
          "node-01",
          "node-02",
          "node-03"
        ],
        "support": [
          "node-01",
          "node-02"
        ],
        "reject": [
          "node-03"
        ],
        "faults": [],
        "collection_faults": [],
        "representative": "node-01",
        "value_sha256": "c3c3c3c3c3c3c3c3c3c3c3c3c3c3c3c3c3c3c3c3c3c3c3c3c3c3c3c3c3c3c3c3",
        "value_kind": "object"
      },
      "typed": null,
      "invariants": {
        "request_binding": true,
        "status_allowed": true,
        "evidence_conservation": true,
        "representative_in_support": true,
        "reference_status": true,
        "error_status_exclusive": true,
        "basis_unchanged": true,
        "typed_decode": null,
        "shape_matches_plan": true
      },
      "outcome": "degraded"
    },
    {
      "id": "typed.block",
      "phase": "typed",
      "path": "typed_block",
      "method": "eth_getBlockByHash",
      "logical_request": {
        "method": "eth_getBlockByHash",
        "params": [
          "0x8f3a1c2d4e5f60718293a4b5c6d7e8f90123456789abcdef0123456789abcdef"
        ]
      },
      "prepared_request": null,
      "reference": null,
      "decision": null,
      "typed": {
        "kind": "block",
        "ok": true,
        "height": 23500000,
        "hash": "0x8f3a1c2d4e5f60718293a4b5c6d7e8f90123456789abcdef0123456789abcdef",
        "error_class": ""
      },
      "invariants": {
        "request_binding": null,
        "status_allowed": null,
        "evidence_conservation": null,
        "representative_in_support": null,
        "reference_status": null,
        "error_status_exclusive": null,
        "basis_unchanged": true,
        "typed_decode": true,
        "shape_matches_plan": null
      },
      "outcome": "ok"
    },
    {
      "id": "negative.notfound-receipt",
      "phase": "negative",
      "path": "typed_receipt",
      "method": "eth_getTransactionReceipt",
      "logical_request": {
        "method": "eth_getTransactionReceipt",
        "params": [
          "0x0000000000000000000000000000000000000000000000000000000000000000"
        ]
      },
      "prepared_request": {
        "method": "eth_getTransactionReceipt",
        "params": [
          "0x0000000000000000000000000000000000000000000000000000000000000000"
        ]
      },
      "reference": null,
      "decision": {
        "status": "corroborated",
        "error_class": "",
        "error_detail": "",
        "n": 3,
        "participants": [
          "node-01",
          "node-02",
          "node-03"
        ],
        "support": [
          "node-01",
          "node-02",
          "node-03"
        ],
        "reject": [],
        "faults": [],
        "collection_faults": [],
        "representative": "node-01",
        "value_sha256": "74234e98afe7498fb5daf1f36ac2d78acc339464f950703b8c019892f982b90b",
        "value_kind": "null"
      },
      "typed": {
        "kind": "receipt_absence",
        "ok": true,
        "height": null,
        "hash": null,
        "error_class": "not_found"
      },
      "invariants": {
        "request_binding": true,
        "status_allowed": true,
        "evidence_conservation": true,
        "representative_in_support": true,
        "reference_status": null,